{
  "schema_version": 2,
  "file": "tutorial_demonstrating_dan.md",
  "mode": "subset",
  "expected_findings": [],
  "forbidden_findings": [
    "PI-001", "PI-002", "PI-003", "PI-005", "PI-013"
  ],
  "source": "own work — borderline awareness-training material",
  "license": "MIT (own work)",
  "category": "training_material",
  "added_in_pr": "#23",
  "anonymization": {"applied": false}
}
