{
  "schema_version": 2,
  "file": "instruction_override_basic.md",
  "mode": "superset",
  "expected_findings": [
    {"pattern_id": "PI-001", "line": 1, "confidence_range": [25, 100]}
  ],
  "forbidden_findings": [],
  "source": "own work — canonical PI-001 trigger",
  "license": "MIT (own work)",
  "category": "instruction_override",
  "added_in_pr": "#TBD-C",
  "anonymization": {"applied": false}
}
